[
  {
    "id": "HQ-A01",
    "version": 1,
    "workstream": "A",
    "objective": "Define the atomic Trace and a sanitized sharing test",
    "owner": "product",
    "persona": "Product Steward",
    "charter_version": "1.0",
    "trigger": {
      "type": "manual",
      "reference": "Oday HQ brief 2026-09-14",
      "dedupe_key": "HQ-A01-v1"
    },
    "inputs_context": [
      "AGENT_CONSTITUTION.md",
      "charters/product.md",
      "Oday current HQ brief"
    ],
    "allowed_tools": [
      "Read redacted evidence and approved roadmap",
      "Inspect product locally",
      "Write specs and priority proposals"
    ],
    "allowed_memory": {
      "read": [
        "memory/company/approved",
        "memory/mandates/product",
        "assigned case scope only"
      ],
      "write": [
        "assigned output path",
        "memory/mandates/product/drafts",
        "memory/proposals"
      ]
    },
    "expected_output": {
      "path": "docs/hq/specs/TRACE_AND_SHARING.md",
      "schema_ref": "schemas/output.schema.json",
      "description": "Experiment/spec: evidence IDs, user task, hypothesis, smallest test, measure, disconfirmation, scope, acceptance, dependencies, approval level"
    },
    "acceptance_criteria": [
      "Explicit conclusion, rule, approvals, evidence, gaps, exceptions and provenance",
      "Recipient access/expiry/redaction/log requirements distinguish prototype from implementation",
      "Preserve discovery and define observable sharing test"
    ],
    "deadline_sla": {
      "due_at": null,
      "starts_on": "dispatch after dependencies and authority are satisfied",
      "active_minutes": 45,
      "review_within_hours": 24
    },
    "approval": {
      "level": "Green",
      "state": "not_required",
      "actor": null,
      "record_ref": null,
      "artifact_hash": null,
      "expires_at": null
    },
    "status": "accepted",
    "dependencies": [],
    "reviewer": "Supervisor + independent Auditor for material claims/security",
    "evidence": [
      {
        "id": "HQ-A01-artifact",
        "source_ref": "specs/TRACE_AND_SHARING.md",
        "location": null,
        "observed_at": "2026-09-14T16:01:37.524940+00:00",
        "claim": "The artifact exists and is submitted for review.",
        "kind": "artifact",
        "limitations": [
          "Submission is not acceptance or authority for external use."
        ]
      },
      {
        "id": "HQ-A01-review",
        "source_ref": "docs/hq/reviews/HQ_REVIEW.md",
        "location": "Disposition and coverage",
        "observed_at": "2026-09-14T21:04:29.035064+00:00",
        "claim": "Independent review permits internal acceptance within its stated scope.",
        "kind": "artifact",
        "limitations": [
          "No consequential external action authorized."
        ]
      }
    ],
    "cost": {
      "currency": "USD",
      "new_spend_limit": 0,
      "actual": null,
      "tokens": null,
      "measurement": "Session allocation; runtime has not exposed job-level usage."
    },
    "limits": {
      "max_tool_calls": 30,
      "max_revisions": 2
    },
    "result": {
      "summary": "Accepted for internal review use. This does not authorize publication, production or customer-data processing.",
      "artifact_refs": [
        "docs/hq/specs/TRACE_AND_SHARING.md",
        "docs/hq/schemas/trace.schema.json",
        "docs/hq/data/sample-trace.json"
      ],
      "review_ref": "docs/hq/reviews/HQ_REVIEW.md",
      "accepted_by": "Supervisor",
      "accepted_at": "2026-09-14T21:04:29.035064+00:00"
    },
    "handoff": {
      "to": [
        "risk",
        "Supervisor"
      ],
      "when": "artifact ready for review; never external execution",
      "payload": [
        "artifact/version",
        "source or test evidence",
        "limitations",
        "next action"
      ]
    },
    "blocker": null,
    "dependency_requirements": {}
  },
  {
    "id": "HQ-A02",
    "version": 1,
    "workstream": "A",
    "objective": "Build a fictional recipient Trace for discovery",
    "owner": "build",
    "persona": "Builder",
    "charter_version": "1.0",
    "trigger": {
      "type": "manual",
      "reference": "Oday HQ brief 2026-09-14",
      "dedupe_key": "HQ-A02-v1"
    },
    "inputs_context": [
      "AGENT_CONSTITUTION.md",
      "charters/build.md",
      "Oday current HQ brief",
      "HQ-A01"
    ],
    "allowed_tools": [
      "Local code read/edit",
      "Local tests and browser preview",
      "Branches and local patches",
      "Draft PR or protected preview only with approved target and no sensitive data"
    ],
    "allowed_memory": {
      "read": [
        "memory/company/approved",
        "memory/mandates/build",
        "assigned case scope only"
      ],
      "write": [
        "assigned output path",
        "memory/mandates/build/drafts",
        "memory/proposals"
      ]
    },
    "expected_output": {
      "path": "docs/hq/artifacts/sanitized-trace",
      "schema_ref": "schemas/output.schema.json",
      "description": "Change packet: branch/base revision, files, behavior, tests, limitations, preview/PR reference, rollback, outstanding approvals"
    },
    "acceptance_criteria": [
      "Fictional label remains on view/export",
      "Each conclusion opens its exact supporting evidence or displays unknown",
      "CTA and missing-evidence interaction can be tested locally"
    ],
    "deadline_sla": {
      "due_at": null,
      "starts_on": "dispatch after dependencies and authority are satisfied",
      "active_minutes": 60,
      "review_within_hours": 24
    },
    "approval": {
      "level": "Green",
      "state": "not_required",
      "actor": null,
      "record_ref": null,
      "artifact_hash": null,
      "expires_at": null
    },
    "status": "ready",
    "dependencies": [
      "HQ-A01"
    ],
    "reviewer": "Supervisor + independent Auditor for material claims/security",
    "evidence": [],
    "cost": {
      "currency": "USD",
      "new_spend_limit": 0,
      "actual": null,
      "tokens": null,
      "measurement": "Session allocation; runtime has not exposed job-level usage."
    },
    "limits": {
      "max_tool_calls": 30,
      "max_revisions": 2
    },
    "result": {
      "summary": "A fictional read-only walkthrough exists within HQ. Finish the experiment-ready artifact and export check before marking this job accepted.",
      "artifact_refs": [
        "app/hq/page.tsx",
        "docs/hq/data/sample-trace.json"
      ],
      "review_ref": null,
      "accepted_by": null,
      "accepted_at": null
    },
    "handoff": {
      "to": [
        "risk",
        "Supervisor"
      ],
      "when": "artifact ready for review; never external execution",
      "payload": [
        "artifact/version",
        "source or test evidence",
        "limitations",
        "next action"
      ]
    },
    "blocker": null,
    "dependency_requirements": {
      "HQ-A01": "accepted"
    }
  },
  {
    "id": "HQ-A03",
    "version": 1,
    "workstream": "A",
    "objective": "Run the sharing question during an authorized existing discovery conversation",
    "owner": "customer-evidence",
    "persona": "Listener",
    "charter_version": "1.0",
    "trigger": {
      "type": "manual",
      "reference": "Oday HQ brief 2026-09-14",
      "dedupe_key": "HQ-A03-v1"
    },
    "inputs_context": [
      "AGENT_CONSTITUTION.md",
      "charters/customer-evidence.md",
      "Oday current HQ brief",
      "HQ-A02",
      "HQ-F01"
    ],
    "allowed_tools": [
      "Read only specifically authorized records",
      "Extract evidence locally within data policy",
      "Write restricted draft records and redacted proposals"
    ],
    "allowed_memory": {
      "read": [
        "memory/company/approved",
        "memory/mandates/customer-evidence",
        "assigned case scope only"
      ],
      "write": [
        "assigned output path",
        "memory/mandates/customer-evidence/drafts",
        "memory/proposals"
      ]
    },
    "expected_output": {
      "path": "docs/hq/artifacts/sharing-observation",
      "schema_ref": "schemas/output.schema.json",
      "description": "Discovery record: recent task, steps, hours, workaround, consequence, owner, deadline, buying route, willingness to pay, verbatim support, unknowns, next step/date"
    },
    "acceptance_criteria": [
      "Record recipient role, reason, redaction objection and next action",
      "Separate stated intent from observed forwarding",
      "Conversation access and contact explicitly authorized"
    ],
    "deadline_sla": {
      "due_at": null,
      "starts_on": "dispatch after dependencies and authority are satisfied",
      "active_minutes": 45,
      "review_within_hours": 24
    },
    "approval": {
      "level": "Red",
      "state": "pending",
      "actor": null,
      "record_ref": null,
      "artifact_hash": null,
      "expires_at": null
    },
    "status": "blocked",
    "dependencies": [
      "HQ-A02",
      "HQ-F01"
    ],
    "reviewer": "Supervisor + independent Auditor for material claims/security",
    "evidence": [],
    "cost": {
      "currency": "USD",
      "new_spend_limit": 0,
      "actual": null,
      "tokens": null,
      "measurement": "Session allocation; runtime has not exposed job-level usage."
    },
    "limits": {
      "max_tool_calls": 30,
      "max_revisions": 2
    },
    "result": {
      "summary": null,
      "artifact_refs": [],
      "review_ref": null,
      "accepted_by": null,
      "accepted_at": null
    },
    "handoff": {
      "to": [
        "risk",
        "Supervisor"
      ],
      "when": "artifact ready for review; never external execution",
      "payload": [
        "artifact/version",
        "source or test evidence",
        "limitations",
        "next action"
      ]
    },
    "blocker": "Original Operating Room/customer evidence and explicit data/action scope are unavailable.",